[
  {
    "file": "face-man-beard-dfa67848.jpg",
    "slug": "face-man-beard",
    "tags": [
      "face",
      "man",
      "beard",
      "cap",
      "yellow"
    ],
    "note": "fuji profile still",
    "source_url": "local:bundle",
    "added": "2026-08-17T12:49:18",
    "width": 400,
    "height": 400,
    "format": "JPEG"
  }
]
